{
  "profile_version": "1.0",
  "contract_version": "2.0",
  "object_type": "disposable_fixture_research_binding",
  "binding_id": "w3b-b-p1-binding-example",
  "binding_digest": "sha256:e9558faeb2ac4c4302fd1142179771aa0f32f224788588828cb9a072d9b09397",
  "task_id": "ACOS-MIG-W3B-B-P1-IMPLEMENTATION-02",
  "user_decision_reference": "ACOS-MIG-W3B-B-P1-IMPLEMENTATION-02-AUTHORIZATION-01",
  "chatgpt_task_evidence": {
    "task_id": "ACOS-MIG-W3B-B-P1-IMPLEMENTATION-02",
    "user_decision_reference": "ACOS-MIG-W3B-B-P1-IMPLEMENTATION-02-AUTHORIZATION-01",
    "scope": "TEST_ONLY_DISPOSABLE_FIXTURE"
  },
  "chatgpt_task_digest": "sha256:3dcc56acce20282f44d69d05fc81590b9705b1ba06b2dfbb8a282f46276bd78d",
  "fixture_instance_id": "fixture-example-001",
  "fixture_factory_version": "w3b-b-p1/1.0",
  "canonical_seed_digest": "sha256:a9efb6b932eb2a45e9be2cb89c364ef02c20ac2de96771f38b3aecff4244c60d",
  "pre_mutation_fixture_digest": "sha256:1111111111111111111111111111111111111111111111111111111111111111",
  "fault_profile": {
    "profile": "FAULT_INJECTOR",
    "statement": "DROP INDEX idx_audit_events_aggregate;",
    "target_index": "idx_audit_events_aggregate",
    "target_table": "audit_events"
  },
  "fault_profile_digest": "sha256:846c3c67abe442b2f7cff7a7896036a222262d7cf75388d7b25b2c1bd3f964b8",
  "snapshot_reference": {
    "profile_version": "1.0",
    "contract_binding": {"contract_version": "2.0"},
    "object_type": "snapshot_reference",
    "snapshot_id": "snapshot:w3b-a:fixture:001",
    "logical_store_claim": "store:shadow:fixture:001",
    "physical_snapshot_path_observation": "/supplied/frozen/state.snapshot.sqlite",
    "snapshot_digest": "sha256:1111111111111111111111111111111111111111111111111111111111111111",
    "snapshot_size": 4096,
    "observed_store_version": 100,
    "canonical_w3a_schema_digest": "sha256:a9efb6b932eb2a45e9be2cb89c364ef02c20ac2de96771f38b3aecff4244c60d",
    "observed_at": "2026-08-25T10:00:00Z",
    "snapshot_status": "FROZEN_SUPPLIED",
    "identity_limitations": [
      "FRESHNESS_NOT_ESTABLISHED",
      "AUTHENTICITY_NOT_ESTABLISHED",
      "LOGICAL_STORE_IDENTITY_NOT_ESTABLISHED",
      "GOVERNANCE_AUTHORITY_NONE"
    ],
    "shadow_status": "SHADOW_ONLY",
    "execution_eligibility": "EXECUTION_INELIGIBLE",
    "authority_status": "AUTHORITY_NONE",
    "mutation_status": "MUTATION_NONE",
    "governance_status": "UNAUTHENTICATED_SHADOW",
    "authority_effect": "NONE",
    "identity_effect": "NONE",
    "execution_effect": "NONE",
    "activation_effect": "NONE",
    "eligible_for_execution": false,
    "plan_effect": "NONE",
    "mutation_effect": "NONE"
  },
  "repair_evidence": {
    "profile_version": "1.0",
    "contract_binding": {"contract_version": "2.0"},
    "object_type": "repair_evidence",
    "evidence_id": "evidence:w3b-a:fixture:001",
    "snapshot_digest": "sha256:1111111111111111111111111111111111111111111111111111111111111111",
    "snapshot_size": 4096,
    "findings": [{
      "code": "MISSING_REQUIRED_INDEX",
      "classification": "DETERMINISTIC_PLAN_CANDIDATE",
      "object_kind": "INDEX",
      "object_reference": "idx_audit_events_aggregate",
      "evidence_digest": "sha256:2222222222222222222222222222222222222222222222222222222222222222",
      "summary": "Canonical index is absent from the supplied snapshot."
    }],
    "evidence_set_digest": "sha256:6c6906ceafc296e8997170abd5d4f719f10bfabee9e59efee105cbca4f632cec",
    "created_at": "2026-08-25T10:00:00Z",
    "shadow_status": "SHADOW_ONLY",
    "execution_eligibility": "EXECUTION_INELIGIBLE",
    "authority_status": "AUTHORITY_NONE",
    "mutation_status": "MUTATION_NONE",
    "governance_status": "UNAUTHENTICATED_SHADOW",
    "authority_effect": "NONE",
    "identity_effect": "NONE",
    "execution_effect": "NONE",
    "activation_effect": "NONE",
    "eligible_for_execution": false,
    "plan_effect": "NONE",
    "mutation_effect": "NONE"
  },
  "repair_plan": {
    "profile_version": "1.0",
    "contract_binding": {"contract_version": "2.0"},
    "object_type": "repair_plan",
    "plan_id": "plan:w3b-a:fixture:001",
    "logical_store_claim": "store:shadow:fixture:001",
    "snapshot_digest": "sha256:1111111111111111111111111111111111111111111111111111111111111111",
    "snapshot_size": 4096,
    "observed_store_version": 100,
    "anomaly_classifications": ["DETERMINISTIC_PLAN_CANDIDATE"],
    "evidence_set_digest": "sha256:6c6906ceafc296e8997170abd5d4f719f10bfabee9e59efee105cbca4f632cec",
    "proposed_diff": [{
      "action": "DECLARE_CANONICAL_INDEX_GAP",
      "subject": "idx_audit_events_aggregate",
      "effect": "NONE",
      "rationale": "Declare a canonical index difference without applying a mutation."
    }],
    "expected_invariant_set": [
      "SOURCE_SNAPSHOT_UNCHANGED",
      "NO_STORE_MUTATION",
      "NO_AUTHORITY_EFFECT",
      "NO_EXECUTION_EFFECT",
      "NO_ACTIVATION_EFFECT",
      "PLAN_TERMINATES_AT_VERIFICATION"
    ],
    "created_at": "2026-08-25T10:00:00Z",
    "plan_digest": "sha256:8e464359205cd5d5b9df2786ff5fe4e75e9b670d262458c52eb3b03a541cae7e",
    "plan_state": "PLANNED",
    "shadow_status": "SHADOW_ONLY",
    "execution_eligibility": "EXECUTION_INELIGIBLE",
    "authority_status": "AUTHORITY_NONE",
    "mutation_status": "MUTATION_NONE",
    "governance_status": "UNAUTHENTICATED_SHADOW",
    "authority_effect": "NONE",
    "identity_effect": "NONE",
    "execution_effect": "NONE",
    "activation_effect": "NONE",
    "eligible_for_execution": false,
    "plan_effect": "NONE",
    "mutation_effect": "NONE"
  },
  "plan_verification": {
    "profile_version": "1.0",
    "contract_binding": {"contract_version": "2.0"},
    "object_type": "repair_plan_verification",
    "verification_id": "verification:w3b-a:fixture:001",
    "plan_id": "plan:w3b-a:fixture:001",
    "plan_digest": "sha256:8e464359205cd5d5b9df2786ff5fe4e75e9b670d262458c52eb3b03a541cae7e",
    "snapshot_digest": "sha256:1111111111111111111111111111111111111111111111111111111111111111",
    "evidence_set_digest": "sha256:6c6906ceafc296e8997170abd5d4f719f10bfabee9e59efee105cbca4f632cec",
    "verification_state": "PLAN_VERIFIED",
    "verified_at": "2026-08-25T10:01:00Z",
    "checks": [
      "SCHEMA_VALID",
      "PLAN_DIGEST_MATCH",
      "SNAPSHOT_BINDING_MATCH",
      "EVIDENCE_BINDING_MATCH",
      "VERSION_BINDING_MATCH",
      "PROPOSED_DIFF_VOCABULARY_VALID",
      "DESTRUCTIVE_PROPOSAL_ABSENT",
      "EXPECTED_INVARIANTS_VALID",
      "NON_AUTHORITY_TAINT_COMPLETE",
      "TERMINAL_STATE_PRESERVED"
    ],
    "shadow_status": "SHADOW_ONLY",
    "execution_eligibility": "EXECUTION_INELIGIBLE",
    "authority_status": "AUTHORITY_NONE",
    "mutation_status": "MUTATION_NONE",
    "governance_status": "UNAUTHENTICATED_SHADOW",
    "authority_effect": "NONE",
    "identity_effect": "NONE",
    "execution_effect": "NONE",
    "activation_effect": "NONE",
    "eligible_for_execution": false,
    "plan_effect": "NONE",
    "mutation_effect": "NONE"
  },
  "plan_id": "plan:w3b-a:fixture:001",
  "plan_digest": "sha256:8e464359205cd5d5b9df2786ff5fe4e75e9b670d262458c52eb3b03a541cae7e",
  "evidence_set_digest": "sha256:6c6906ceafc296e8997170abd5d4f719f10bfabee9e59efee105cbca4f632cec",
  "allowed_action": "RECREATE_MISSING_CANONICAL_INDEX",
  "expected_postconditions": {
    "index_name": "idx_audit_events_aggregate",
    "table_name": "audit_events",
    "index_columns": ["aggregate_type", "aggregate_id", "sequence"],
    "unexpected_schema_objects": []
  },
  "expected_postconditions_digest": "sha256:5286ac947f35481cdfff9c0bf7b4c3d620cd4552f3ee1a6dac22f7ff18e4eb38",
  "maximum_mutation_count": 1,
  "issued_at": "2026-01-01T00:00:00Z",
  "expires_at": "2027-01-01T00:00:00Z",
  "operation_id": "w3b-b-p1-operation-example",
  "nonce": "declared-shadow-nonce-example",
  "executor_claim": "Codex Executor",
  "authorization_source_claim": "User Decision",
  "scope": "DISPOSABLE_FIXTURE_ONLY",
  "evidence_class": "DECLARED_BINDING_EVIDENCE",
  "governance_status": "UNAUTHENTICATED_SHADOW",
  "effects": "NONE",
  "eligible_for_execution": false,
  "fixture_mutation_scope": "TEST_ONLY_DISPOSABLE_FIXTURE",
  "production_repair_effect": "NONE",
  "production_eligibility": false,
  "operational_entry_effect": "NONE"
}
